{
  "manifestVersion": "1.0.0",
  "productId": "ai-video-channel-production",
  "productName": "AI 视频频道生产系统",
  "productVersion": "0.1.0-beta.2",
  "releaseChannel": "beta",
  "releaseStatus": "draft",
  "generatedAt": "2026-08-03T16:08:15Z",
  "repository": "https://github.com/coisu772-code/AI-",
  "gitCommit": null,
  "hashAlgorithm": "SHA-256",
  "hashRule": "canonical-json-v1",
  "contentHash": "77a432d6a2c0913b6874193b79fb8f74049ffced928a51a078991e047de7df8e",
  "schemaVersions": {
    "channel-profile": "1.0.0",
    "production-profile": "1.0.0",
    "source-package": "1.0.0",
    "topic-package": "1.0.0",
    "manuscript-package": "1.0.0",
    "publishing-asset-package": "1.0.0",
    "production-result-package": "1.0.0",
    "publish-intent": "1.0.0",
    "publication-receipt": "1.0.0",
    "analytics-snapshot": "1.0.0"
  },
  "protocolVersions": {
    "contractExchange": "1.0.0",
    "localToolService": "0.0.0",
    "installerState": "1.0.0"
  },
  "components": [
    {
      "componentId": "codex-plugin",
      "version": "0.1.0-beta.2",
      "includedInRelease": true,
      "status": "ready",
      "minimumProductVersion": "0.1.0-beta.2",
      "maximumProductVersion": "0.1.0-beta.2",
      "artifacts": [
        {
          "kind": "directory-tree",
          "relativePath": "plugins/ai-video-channel-production",
          "sha256": "5ab1018d857bece79ba32a76d74b09fe5564fd502dfb1bb4b26a357939ae7286",
          "sizeBytes": 5992
        }
      ],
      "notes": "Codex 总入口与显式频道建库入口；阶段 1 仅开放边界说明和契约导航。"
    },
    {
      "componentId": "windows-installer",
      "version": "0.1.0-beta.2",
      "includedInRelease": true,
      "status": "ready",
      "minimumProductVersion": "0.1.0-beta.2",
      "maximumProductVersion": "0.1.0-beta.2",
      "artifacts": [
        {
          "kind": "directory-tree",
          "relativePath": "installer",
          "sha256": "2b8d35a51705f7b28cc69eaa15bcc012ea09a91ebcbf11285b7f6f1cf81f1a00",
          "sizeBytes": 17258
        }
      ],
      "notes": "Windows 本地安装、升级、回滚与卸载脚本；用户配置注册可显式跳过。"
    },
    {
      "componentId": "cross-center-contracts",
      "version": "1.0.0",
      "includedInRelease": true,
      "status": "ready",
      "minimumProductVersion": "0.1.0-beta.2",
      "maximumProductVersion": "0.1.0-beta.2",
      "artifacts": [
        {
          "kind": "directory-tree",
          "relativePath": "contracts",
          "sha256": "091c791da15decf29150f22973508e7a03c0733068d1977edb61399e1b3d70c4",
          "sizeBytes": 43382
        }
      ],
      "notes": "10 类 JSON Schema 契约、完整示例链、内容哈希和上游引用校验。"
    },
    {
      "componentId": "local-tool-service",
      "version": "0.0.0",
      "includedInRelease": false,
      "status": "skeleton",
      "minimumProductVersion": "0.1.0-beta.2",
      "maximumProductVersion": "0.1.0-beta.2",
      "artifacts": [],
      "notes": "阶段 2 才实现；阶段 1 不启动、不调用任何本地业务服务。"
    },
    {
      "componentId": "control-center",
      "version": "0.11.0",
      "includedInRelease": false,
      "status": "external-baseline",
      "minimumProductVersion": "0.1.0-beta.2",
      "maximumProductVersion": "0.1.0-beta.2",
      "artifacts": [],
      "notes": "现有工作区基线，仅记录兼容信息；本阶段未复制、打包或修改。"
    },
    {
      "componentId": "workshop",
      "version": "1.0.0",
      "includedInRelease": false,
      "status": "external-baseline",
      "minimumProductVersion": "0.1.0-beta.2",
      "maximumProductVersion": "0.1.0-beta.2",
      "artifacts": [],
      "notes": "现有新漫剧工坊基线，仅记录兼容信息；本阶段未复制、打包或修改。"
    },
    {
      "componentId": "publisher-center",
      "version": "0.1.0",
      "includedInRelease": false,
      "status": "external-baseline",
      "minimumProductVersion": "0.1.0-beta.2",
      "maximumProductVersion": "0.1.0-beta.2",
      "artifacts": [],
      "notes": "现有 YouTube 发布中心基线，仅记录兼容信息；本阶段未复制、打包或修改。"
    }
  ]
}
